<?xml version="1.0" encoding="UTF-8"?>
<tns:SearchObjectResponse xmlns:tns="http://schemas.cordys.com/1.0/SAPSchema" xmlns:xsi="http://www.w3.org/2001/XMLSchema-instance" xsi:schemaLocation="http://schemas.cordys.com/1.0/SAPSchema iets.xsd ">
  <tns:tuple>
    <tns:old>
      <tns:objectdetails>
        <tns:displayname>tns:displayname</tns:displayname>
        <tns:data>
          <tns:rfc>
            <tns:functionname>tns:functionname</tns:functionname>
            <tns:groupname>tns:groupname</tns:groupname>
            <tns:application>tns:application</tns:application>
            <tns:host>tns:host</tns:host>
            <tns:stext>tns:stext</tns:stext>
          </tns:rfc>
        </tns:data>
      </tns:objectdetails>
    </tns:old>
  </tns:tuple>
</tns:SearchObjectResponse>
